<?xml version="1.0" encoding="utf-8"?>
<xs:schema attributeFormDefault="unqualified" elementFormDefault="qualified" xmlns:xs="http://www.w3.org/2001/XMLSchema">
	<xs:element name="settlements">
		<xs:complexType>
			<xs:sequence>
				<xs:element maxOccurs="unbounded" name="settlement">
					<xs:complexType>
						<xs:sequence>
							<xs:element name="placename" type="xs:string" />
							<xs:element name="neighbours">
								<xs:complexType>
									<xs:sequence>
										<xs:element maxOccurs="unbounded" name="neighbour">
											<xs:complexType>
												<xs:sequence>
													<xs:element name="name" type="xs:string" />
													<xs:element name="distance" type="xs:unsignedByte" />
												</xs:sequence>
											</xs:complexType>
										</xs:element>
									</xs:sequence>
								</xs:complexType>
							</xs:element>
							<xs:element name="resources">
								<xs:complexType>
									<xs:sequence>
										<xs:element maxOccurs="unbounded" name="resource">
											<xs:complexType>
												<xs:simpleContent>
													<xs:extension base="xs:integer">
														<xs:attribute name="name" type="xs:string" use="required" />
													</xs:extension>
												</xs:simpleContent>
											</xs:complexType>
										</xs:element>
									</xs:sequence>
								</xs:complexType>
							</xs:element>
						</xs:sequence>
					</xs:complexType>
				</xs:element>
			</xs:sequence>
		</xs:complexType>
	</xs:element>
</xs:schema>